{
  "schemaVersion": "defracto.ascii-sketch-layout.v1",
  "layoutKey": "defracto.founding-ui-sketch.layout.v1",
  "layoutKind": "ascii-sketch-layout",
  "layoutStatus": "accepted",
  "targetPath": "examples/target-sketches/projections/founding-lineage-flow.ascii",
  "sourceLineage": {
    "storyKey": "stories/projections/ui-sketch-projection.story.v1.json",
    "canonicalSpecKey": "specs/canonical/projections/ui-sketch-projection.canonical-spec.v1.json",
    "projectionManifestKey": "contracts/projections/founding-ui-sketch.projection-manifest.v1.json",
    "renderSejKey": "contracts/sej/render-founding-ui-sketch.sej.v1.json"
  },
  "canvas": {
    "widthColumns": 72,
    "heightLines": 5,
    "fontFamily": "monospace",
    "alignment": "left",
    "lineWrapping": "forbidden",
    "indentation": 0
  },
  "nodeOrder": [
    "generated_header",
    "source_sej",
    "contract_key",
    "doorway_label",
    "layout_truth"
  ],
  "nodeLabels": {
    "generated_header": "# GENERATED BY SEJ RUNTIME RESOLVER. DO NOT EDIT.",
    "source_sej": "# sourceSEJ: contracts/sej/materialize-founding-ui-sketch.sej.v1.json",
    "contract_key": "# contractKey: defracto.sej.materialize-founding-ui-sketch.v1",
    "doorway_label": "# Generated UI sketch doorway for defracto.projections.ui_sketch_projection.",
    "layout_truth": "# This file is resolver-materialized and owns no layout truth."
  },
  "edgeRelationships": [
    { "from": "generated_header", "to": "source_sej", "connector": "next-line" },
    { "from": "source_sej", "to": "contract_key", "connector": "next-line" },
    { "from": "contract_key", "to": "doorway_label", "connector": "next-line" },
    { "from": "doorway_label", "to": "layout_truth", "connector": "next-line" }
  ],
  "connectorRules": [
    "Each node is rendered on a single line.",
    "Each line begins with a single hash comment prefix and one space.",
    "No blank lines may appear between nodes.",
    "No wrapping or alternative alignment is permitted.",
    "No decorative boxes, borders, or extra glyphs may be invented."
  ],
  "renderedLineContent": [
    "# GENERATED BY SEJ RUNTIME RESOLVER. DO NOT EDIT.",
    "# sourceSEJ: contracts/sej/materialize-founding-ui-sketch.sej.v1.json",
    "# contractKey: defracto.sej.materialize-founding-ui-sketch.v1",
    "# Generated UI sketch doorway for defracto.projections.ui_sketch_projection.",
    "# This file is resolver-materialized and owns no layout truth."
  ],
  "completionPosture": "This layout contract gives the ASCII sketch deterministic layout authority without authorizing a new render.",
  "forbiddenLayoutInvention": [
    "changing the line order",
    "changing the line labels",
    "adding extra lines",
    "adding blank lines",
    "adding boxes or borders",
    "adding alternate connector glyphs",
    "changing the target path",
    "changing the layout content without contract revision"
  ]
}
